{"schema_version":1,"session_id":"shared-default-encoding","capture_mode":"horizontal","projection":"rectilinear","viewport":{"width":1280,"height":720},"fov":{"horizontal_deg":80.0,"vertical_deg":50.0,"source":"configured_value"},"base_pose":{"position":[1.0,2.0,3.0],"orientation_xyzw":[0.0,0.0,0.0,1.0]},"planner":{"overlap_fraction":0.1,"yaw_step_deg":72.0,"pitch_step_deg":45.0},"frames":[{"index":2,"filename":"legacy.png","yaw_deg":10.0,"pitch_deg":-5.0,"roll_deg":1.0,"status":"planned","camera_basis_row_major":[1.0,0.0,0.0,0.0,1.0,0.0,0.0,0.0,1.0]}],"completed":false}
